file_id,filename,category,file_path,page_count,title,publication_year,doi,xml_title,journal,publisher
HEA-PRO_60,HEA-PRO_60.pdf,HEA-PRO,benchmarks/cex/all_pdfs/HEA-PRO_60.pdf,4,"Hiroshi Katoh, Effect of lateral-wedge insole on the center of foot pressure and lower extremity muscle activity at gait initiation in patients with medial knee osteoarthritis, Journal of Physical Therapy Science, 2019, Volume 31, Issue 10, Pages 776-779, Released on J-STAGE October 19, 2019, https://doi.org/10.1589/jpts.31.776 (Open Access)",,10.1589/jpts.31.776,Effect of lateral-wedge insole on the center of foot pressure and lower extremity muscle activity at gait initiation in patients with medial knee osteoarthritis,The Journal of Physical Therapy Science,IPEC Inc.
CHEM_23,CHEM_23.pdf,CHEM,benchmarks/cex/all_pdfs/CHEM_23.pdf,5,"Alisson Bezerra Martins, Alnilan Lobato, Nikola Tasić, Fernando J. Perez-Sanz, Pedro Vidinha, Thiago R.L.C. Paixão, Luís Moreira Gonçalves, Laser-pyrolyzed electrochemical paper-based analytical sensor for sulphite analysis, Electrochemistry Communications, 107 (2019). https://doi.org/10.1016/j.elecom.2019.106541. (Open Access)",2019,10.1016/j.elecom.2019.106541.,Laser-pyrolyzed electrochemical paper-based analytical sensor for sulphite analysis,Electrochemistry Communications,Elsevier BV
ECO-ECO-FIN_43,ECO-ECO-FIN_43.pdf,ECO-ECO-FIN,benchmarks/cex/all_pdfs/ECO-ECO-FIN_43.pdf,14,"Athanasios Andrikopoulos, Changyu Wang, Min Zheng, Is there still a weather anomaly? An investigation of stock and foreign exchange markets, Finance Research Letters, 30 (2019). https://doi.org/10.1016/j.frl.2019.03.026. (PREPRINT)",,10.1016/j.frl.2019.03.026.,Is There Still A Weather Anomaly? An Investigation of Stock and Foreign Exchange Markets,,
COM-SCI_25,COM-SCI_25.pdf,COM_SCI,benchmarks/cex/all_pdfs/COM-SCI_25.pdf,22,"Athreyas, N., Gupta, D. & Gupta, J. Analog signal processing solution for machine vision applications. J Real-Time Image Proc 16, 1607–1628 (2019). https://doi.org/10.1007/s11554-017-0669-4 (Open Access)",2017,10.1007/s11554-017-0669-4,Analog signal processing solution for machine vision applications,Journal of Real-Time Image Processing,Springer
ECO-ECO-FIN_42,ECO-ECO-FIN_42.pdf,ECO-ECO-FIN,benchmarks/cex/all_pdfs/ECO-ECO-FIN_42.pdf,11,"Pablo Castañeda, Lorenzo Reus, Suboptimal investment behavior and welfare costs: A simulation based approach, Finance Research Letters, 30 (2019).https://doi.org/10.1016/j.frl.2018.09.009. (Restricted)",2018,10.1016/j.frl.2018.09.009.,Suboptimal investment behavior and welfare costs: A simulation based approach,Finance Research Letters,Elsevier BV
CHEM_22,CHEM_22.pdf,CHEM,benchmarks/cex/all_pdfs/CHEM_22.pdf,6,"Zhou, Xuanbo and Li, Yunfeng and Xing, Yan and Li, Junsong and Jiang, Xin, Effects of the preparation method of Pt/g-C3N4 photocatalysts on their efficiency for visible-light hydrogen production, Dalton Trans., 48(40) (2019). http://dx.doi.org/10.1039/C9DT02938A (Restricted)",2019,,Effects of the preparation method of Pt/g-C 3 N 4 photocatalysts on their efficiency for visible-light hydrogen production,Dalton Transactions,Royal Society of Chemistry
IMM-MIC_64,IMM-MIC_64.pdf,IMM-MIC,benchmarks/cex/all_pdfs/IMM-MIC_64.pdf,9,"Kerr, Leena, Hoskisson, Paul A., Reconciling DNA replication and transcription in a hyphal organism: visualizing transcription complexes in live Streptomyces coelicolor, 2019, Microbiology, 165 (10), https://doi.org/10.1099/mic.0.000834 (Open Access)",2019,10.1099/mic.0.000834,Reconciling DNA replication and transcription in a hyphal organism: visualizing transcription complexes in live Streptomyces coelicolor,Microbiology,
MATH_69,MATH_69.pdf,MATH,benchmarks/cex/all_pdfs/MATH_69.pdf,13,"R. B. Bapat & S. K. Panda (2019) Almost self-inverse graphs, Linear and Multilinear Algebra, 67:10, 2065-2076, DOI: 10.1080/03081087.2018.1481357 (Restricted)",2018,,Almost self-inverse graphs,LINEAR AND MULTILINEAR ALGEBRA,Taylor & Francis Group
